{
  "event_id": "9a8b7c6d-5e4f-4a3b-2c1d-0e9f8a7b6c5d",
  "event_type": "TradeRequested",
  "schema_version": "1",
  "correlation_id": "1c2d3e4f-5a6b-7c8d-9e0f-112233445566",
  "produced_at": "2026-09-01T12:00:00.200Z",
  "producer": "dashboard",
  "data": {
    "request_id": "0d1e2f3a-4b5c-6d7e-8f90-a1b2c3d4e5f6",
    "account_id": "acct_123",
    "symbol": "AAPL",
    "side": "BUY",
    "quantity": 10,
    "price": 187.42,
    "requested_by": "user_42"
  }
}
