{
  "event_id": "3f2e1d0c-9b8a-4756-8493-2a1b0c9d8e7f",
  "event_type": "LedgerUpdated",
  "schema_version": "1",
  "correlation_id": "1c2d3e4f-5a6b-7c8d-9e0f-112233445566",
  "produced_at": "2026-09-01T12:00:00.500Z",
  "producer": "ledger-core",
  "data": {
    "journal_entry_id": "je_1001",
    "source_event_id": "0d1e2f3a-4b5c-6d7e-8f90-a1b2c3d4e5f6",
    "account_id": "acct_123",
    "symbol": "AAPL",
    "side": "BUY",
    "quantity": 10,
    "price": 187.42,
    "cash_delta": -1874.20,
    "position_after": 10,
    "posted_at": "2026-09-01T12:00:00.500Z"
  }
}
